{"schema_version":"1","request_identity":"request-0001","operation":"source-snippets","status":"ready","provider_identity":"taf.native.level1","provider_version":"0.1.0","index_identity":"sha256:4444444444444444444444444444444444444444444444444444444444444444","repository_identity":"sha256:1111111111111111111111111111111111111111111111111111111111111111","worktree_identity":"sha256:2222222222222222222222222222222222222222222222222222222222222222","committed_head":"aaaaaaaaaaaaaaaaaaaaaaaaaaaaaaaaaaaaaaaa","dirty_overlay_fingerprint":"sha256:3333333333333333333333333333333333333333333333333333333333333333","freshness":"exact","parser_versions":{"tree-sitter-python":"0.25.0"},"coverage":{"path_coverage":1,"language_coverage":1,"indexed_path_count":1,"excluded_path_count":0,"unsupported_language_count":0,"parse_failure_count":0,"exclusion_reason_counts":{}},"findings":[{"rank":1,"result_identity":"sha256:5555555555555555555555555555555555555555555555555555555555555555","path":"tools/taf-context/taf_context/recovery.py","start_line":10,"end_line":14,"language":"Python","record_kind":"definition","source_type":"source","qualified_name":"taf_context.recovery.RecoveryDossier","extraction_method":"tree-sitter-python@0.25.0","evidence_class":"verified","preview":""}],"returned_count":1,"omitted_count":0,"truncated":false,"output_characters":348,"warnings":[],"next_safe_action":"use-cited-evidence"}
