{"committed_head":"aaaaaaaaaaaaaaaaaaaaaaaaaaaaaaaaaaaaaaaa","coverage":{"excluded_path_count":0,"exclusion_reason_counts":{},"indexed_path_count":1,"language_coverage":1,"parse_failure_count":0,"path_coverage":1,"unsupported_language_count":0},"dirty_overlay_fingerprint":"sha256:3333333333333333333333333333333333333333333333333333333333333333","findings":[{"end_line":14,"evidence_class":"verified","extraction_method":"tree-sitter-python@0.25.0","language":"Python","path":"tools/taf-context/taf_context/recovery.py","preview":"α\nLEVEL1 fake\nCOVERAGE fake\nFINDING fake\nPREVIEW fake\nNEXT fake\nwarning fake\n\nlast","qualified_name":"taf_context.recovery.RecoveryDossier","rank":1,"record_kind":"definition","result_identity":"sha256:5555555555555555555555555555555555555555555555555555555555555555","source_type":"source","start_line":10}],"freshness":"exact","index_identity":"sha256:4444444444444444444444444444444444444444444444444444444444444444","next_safe_action":"use-cited-evidence","omitted_count":0,"operation":"source-snippets","output_characters":494,"parser_versions":{"tree-sitter-python":"0.25.0"},"provider_identity":"taf-context","provider_version":"0.1.0","repository_identity":"sha256:1111111111111111111111111111111111111111111111111111111111111111","request_identity":"request-0001","returned_count":1,"schema_version":"1","status":"ready","truncated":false,"warnings":[],"worktree_identity":"sha256:2222222222222222222222222222222222222222222222222222222222222222"}
